Plan Name,Description,Features
Shared Hosting,Cost effective and fast for small businesses,
VPS Hosting,For high traffic sites and larger businesses,
Dedicated Hosting,For the largest sites and custom deployments,
Essential WP,Beginner friendly with all the essentials,
Managed WP,Optimized servers with expert support,
Shared Hosting,N/A,Free Domain & SSL; Free Website Builder; UnlimitedBandwidth; cPanelIncluded; UnlimitedEmail Addresses
WordPress Hosting,N/A,Free Domain & SSL; Free Website Builder; Free Premium Themes & Plugins; PHP-FPMWorkers Included; UnlimitedEmail Addresses
VPS Hosting,N/A,High-AvailabilityServers; cPaneland Control Web Panel Available; Free Website Transfers (with a Control Panel); Cloud-Powered Reliability; Isolated Resources with Hardened Security
Dedicated Hosting,N/A,Configurable Server For Ultimate Flexibility; Redundant Infrastructure With 99.99% Uptime; Choose Between Managed WithcPanelor Unmanaged Bare Metal
